title,type,question,A,B,C,D,answer,image
Biological Control,radio,More environmental-friendly / Lebih mesra alam,好处,坏处,,,A,
,radio,Does not harm the health of other organisms except crop pests / Tidak memudaratkan kesihatan organisma lain kecuali perosak tumbuhan,好处,坏处,,,A,
,radio,Does not cause crop pests to become resistant / Tidak menyebabkan perosak tumbuhan berdaya tahan,好处,坏处,,,A,
,radio,Cheaper / Lebih murah,好处,坏处,,,A,
,radio,Takes a longer time to control the population of crop pests / Mengambil masa yang lebih panjang untuk mengawal populasi perosak tanaman,好处,坏处,,,B,
,radio,Difficult to predict the results of biological control which involves living organisms / Sukar meramalkan hasil kawalan biologi yang melibatkan organisma hidup,好处,坏处,,,B,
,radio,Needs more detailed and effective planning and management / Memerlukan perancangan dan pengurusan yang lebih teliti dan berkesan,好处,坏处,,,B,
,radio,Disrupts the balance of ecosystem if populations of the predator species or parasite become uncontrollable / Mengganggu keseimbangan ekosistem jika populasi spesies pemangsa atau parasit menjadi tidak terkawal,好处,坏处,,,B,
